{
  "schema_version": 2,
  "receipt_id": "receipt_coord_roguelike_202605",
  "batch_id": "coord_roguelike_202605",
  "baseline_commit": "52f52f7cd33d1711579f9cccbe4c848ab45a02e4",
  "recovery_tag": "recovery/estudio-documentation-lite/v2/2026-07-17-pre-cutover",
  "generated_at": "2026-07-17T15:21:05.104314Z",
  "index_sha256": "d678bcfdb80174d5cdc80772241823861405d5893db593eee3cd73a123c597a9",
  "manifest_sha256": "89d6336f2c17d76eaaedef2ac973059c782a17da686b2f29d2a970aeb3398cdc",
  "entries": [
    {
      "path": "08_Coordenacao_Agentes/Kanban/Done/2026-05-07_codex_draxos-roguelike-cardgame_bootstrap.md",
      "sha256": "2eed91c5d327fd3b292d9f0776ee9d0f7a7404003d19f78a237ef9244c0be6e1",
      "git_blob": "4edce9381529e062c6a5ef78de640a6fcdfa5f87",
      "record_id": "rec_2026_05_07_codex_draxos_roguelike_cardgame_bo_08aaf04f70",
      "ledger_path": "Projetos/draxos-roguelike-cardgame/implementation/history-ledger/2026-05.md",
      "retained_authorities": [
        "Projetos/draxos-roguelike-cardgame/implementation/history-ledger/2026-05.md",
        "Projetos/draxos-roguelike-cardgame/implementation/history.md",
        "Projetos/draxos-roguelike-cardgame/qa/QA_INDEX.md"
      ]
    },
    {
      "path": "08_Coordenacao_Agentes/Kanban/Done/2026-05-07_codex_draxos-roguelike-cardgame_track-01.md",
      "sha256": "3c9d3387fff91e046d3ccc42dabc6960f1458b361ebf98a052115b2645b0b1a5",
      "git_blob": "6756af10a3756ce8c8c350632313887f03e989ec",
      "record_id": "rec_2026_05_07_codex_draxos_roguelike_cardgame_tr_0f95b6f5c6",
      "ledger_path": "Projetos/draxos-roguelike-cardgame/implementation/history-ledger/2026-05.md",
      "retained_authorities": [
        "Projetos/draxos-roguelike-cardgame/implementation/history-ledger/2026-05.md",
        "Projetos/draxos-roguelike-cardgame/implementation/history.md",
        "Projetos/draxos-roguelike-cardgame/qa/QA_INDEX.md"
      ]
    },
    {
      "path": "08_Coordenacao_Agentes/Kanban/Done/2026-05-18_codex_draxos-roguelike-cardgame_track-02.md",
      "sha256": "060ac1fa4d37800ebc2c997025d0e4946b80ca5a188f87a247afdff7d4b17fd4",
      "git_blob": "91208839a9caef90742210b8f3f135563f8df20e",
      "record_id": "rec_2026_05_18_codex_draxos_roguelike_cardgame_tr_7b88e98219",
      "ledger_path": "Projetos/draxos-roguelike-cardgame/implementation/history-ledger/2026-05.md",
      "retained_authorities": [
        "Projetos/draxos-roguelike-cardgame/implementation/history-ledger/2026-05.md",
        "Projetos/draxos-roguelike-cardgame/implementation/history.md",
        "Projetos/draxos-roguelike-cardgame/qa/QA_INDEX.md"
      ]
    },
    {
      "path": "08_Coordenacao_Agentes/Kanban/Done/2026-05-27_codex_draxos-roguelike-foundation-hardening-2.md",
      "sha256": "6544fc3f6d0b42fec2c30da85eff2f2ac99a89b578c6847911a12ba7255a5ec5",
      "git_blob": "de09435b93123cccd0a69e80e7a066ea48ef7732",
      "record_id": "rec_2026_05_27_codex_draxos_roguelike_foundation_0f12bd5ee3",
      "ledger_path": "Projetos/draxos-roguelike-cardgame/implementation/history-ledger/2026-05.md",
      "retained_authorities": [
        "Projetos/draxos-roguelike-cardgame/implementation/history-ledger/2026-05.md",
        "Projetos/draxos-roguelike-cardgame/implementation/history.md",
        "Projetos/draxos-roguelike-cardgame/qa/QA_INDEX.md"
      ]
    },
    {
      "path": "08_Coordenacao_Agentes/Kanban/Done/2026-05-27_codex_draxos-roguelike-foundation-hardening-3.md",
      "sha256": "5262b14659d077c366bfb80b0620c51ce464989515b653459f5bac4216e111ae",
      "git_blob": "bc76c0fb1ca16dd9f18f4937d207d68d9772cc8a",
      "record_id": "rec_2026_05_27_codex_draxos_roguelike_foundation_89408f024a",
      "ledger_path": "Projetos/draxos-roguelike-cardgame/implementation/history-ledger/2026-05.md",
      "retained_authorities": [
        "Projetos/draxos-roguelike-cardgame/implementation/history-ledger/2026-05.md",
        "Projetos/draxos-roguelike-cardgame/implementation/history.md",
        "Projetos/draxos-roguelike-cardgame/qa/QA_INDEX.md"
      ]
    },
    {
      "path": "08_Coordenacao_Agentes/Kanban/Done/2026-05-27_codex_draxos-roguelike-foundation-hardening-4.md",
      "sha256": "d781b7ce51c9243e8b003ecca99c052bddcdcc21701e02e02addab9586ba9ebe",
      "git_blob": "2ec64dfab2af37c2025bb627834eacceb12dac4f",
      "record_id": "rec_2026_05_27_codex_draxos_roguelike_foundation_7fa1c732b5",
      "ledger_path": "Projetos/draxos-roguelike-cardgame/implementation/history-ledger/2026-05.md",
      "retained_authorities": [
        "Projetos/draxos-roguelike-cardgame/implementation/history-ledger/2026-05.md",
        "Projetos/draxos-roguelike-cardgame/implementation/history.md",
        "Projetos/draxos-roguelike-cardgame/qa/QA_INDEX.md"
      ]
    },
    {
      "path": "08_Coordenacao_Agentes/Kanban/Done/2026-05-27_codex_draxos-roguelike-foundation-hardening-5.md",
      "sha256": "b1e65cd6ae92e5b950b66dcb488a851e8fe25065f7f1b4d9f6d98f86563c931d",
      "git_blob": "224eef71d6151220e9ab3c57f673dfc183ef7374",
      "record_id": "rec_2026_05_27_codex_draxos_roguelike_foundation_33063c95bd",
      "ledger_path": "Projetos/draxos-roguelike-cardgame/implementation/history-ledger/2026-05.md",
      "retained_authorities": [
        "Projetos/draxos-roguelike-cardgame/implementation/history-ledger/2026-05.md",
        "Projetos/draxos-roguelike-cardgame/implementation/history.md",
        "Projetos/draxos-roguelike-cardgame/qa/QA_INDEX.md"
      ]
    },
    {
      "path": "08_Coordenacao_Agentes/Kanban/Done/2026-05-27_codex_draxos-roguelike-foundation-hardening.md",
      "sha256": "9b51743fd5d6cd29822e97e3bdfb62b3f4c3a7d03103aca376fce5fde87e0e77",
      "git_blob": "43e7cf0bb22b9ab3a0e95cbe024dd53329d5a0a7",
      "record_id": "rec_2026_05_27_codex_draxos_roguelike_foundation_ae4d31e6dc",
      "ledger_path": "Projetos/draxos-roguelike-cardgame/implementation/history-ledger/2026-05.md",
      "retained_authorities": [
        "Projetos/draxos-roguelike-cardgame/implementation/history-ledger/2026-05.md",
        "Projetos/draxos-roguelike-cardgame/implementation/history.md",
        "Projetos/draxos-roguelike-cardgame/qa/QA_INDEX.md"
      ]
    },
    {
      "path": "08_Coordenacao_Agentes/Kanban/Done/2026-05-28_codex_draxos-roguelike-foundation-hardening-6.md",
      "sha256": "6ffad1fa8eb2cb259813caf3f2c1f735f1609a611dd89f3d0098fa85f56adbd7",
      "git_blob": "9ef3775467890a535b75dbaf616c7ce6624eac3b",
      "record_id": "rec_2026_05_28_codex_draxos_roguelike_foundation_a522bfd3d7",
      "ledger_path": "Projetos/draxos-roguelike-cardgame/implementation/history-ledger/2026-05.md",
      "retained_authorities": [
        "Projetos/draxos-roguelike-cardgame/implementation/history-ledger/2026-05.md",
        "Projetos/draxos-roguelike-cardgame/implementation/history.md",
        "Projetos/draxos-roguelike-cardgame/qa/QA_INDEX.md"
      ]
    }
  ]
}
